{
  "$schema": "https://open-guji.org/schema/punct/v0.2.json",
  "version": "1.4.0",
  "text_version": "1.0.0",
  "book_id": "96mid1ogzk",
  "volume": 2,
  "metadata": {
    "title": "欽定四庫全書總目·第2册",
    "creator": "claude:GUJI-240",
    "base_edition": "original",
    "description": "卷二开头：卷名、副题、類名、首篇书名行，带标题符（v0.2 样例）"
  },
  "stats": {
    "total_annotations": 10,
    "headings": 4,
    "paragraph_breaks": 4
  },
  "punctuations": [
    {
      "mark": "#",
      "kind": "heading",
      "pos": "before",
      "anchor": "39:1:1",
      "label": "卷二　經部二",
      "source": "claude:GUJI-240"
    },
    {
      "mark": "\n\n",
      "kind": "break",
      "pos": "before",
      "anchor": "39:2:2",
      "pre_char": "經",
      "source": "claude:GUJI-240"
    },
    {
      "mark": "#",
      "kind": "heading",
      "pos": "before",
      "anchor": "39:2:2",
      "toc": false,
      "source": "claude:GUJI-240"
    },
    {
      "mark": "\n\n",
      "kind": "break",
      "pos": "before",
      "anchor": "39:3:3",
      "pre_char": "易",
      "source": "claude:GUJI-240"
    },
    {
      "mark": "##",
      "kind": "heading",
      "pos": "before",
      "anchor": "39:3:3",
      "source": "claude:GUJI-240"
    },
    {
      "mark": "\n\n",
      "kind": "break",
      "pos": "before",
      "anchor": "39:4:1",
      "pre_char": "易",
      "source": "claude:GUJI-240"
    },
    {
      "mark": "###",
      "kind": "heading",
      "pos": "before",
      "anchor": "39:4:1",
      "source": "claude:GUJI-240"
    },
    {
      "mark": "《",
      "kind": "point",
      "pos": "before",
      "anchor": "39:4:1",
      "pre_char": "易",
      "source": "claude:GUJI-240"
    },
    {
      "mark": "》",
      "kind": "point",
      "pos": "after",
      "anchor": "39:4:5",
      "pre_char": "圖",
      "source": "claude:GUJI-240"
    },
    {
      "mark": "\n\n",
      "kind": "break",
      "pos": "after",
      "anchor": "39:4:18b",
      "pre_char": "本",
      "source": "claude:GUJI-240"
    }
  ]
}